{
  "$schema": "http://json-schema.org/draft-07/schema#",
  "$id": "https://cleargate.dev/schemas/state.v2.json",
  "title": "ClearGate Sprint State v2",
  "description": "Schema for .cleargate/sprint-runs/<sprint-id>/state.json. schema_version=2 adds per-story lane fields (lane, lane_assigned_by, lane_demoted_at, lane_demotion_reason). Migrated from v1 on first read by update_state.mjs.",
  "type": "object",
  "required": [
    "schema_version",
    "sprint_id",
    "execution_mode",
    "sprint_status",
    "stories",
    "last_action",
    "updated_at"
  ],
  "additionalProperties": true,
  "properties": {
    "schema_version": {
      "type": "integer",
      "const": 2,
      "description": "Schema version. Must be 2 for v2 state files. Bumped from v1 by migration in update_state.mjs."
    },
    "sprint_id": {
      "type": "string",
      "description": "Sprint identifier, e.g. S-09",
      "examples": ["S-09", "S-10"]
    },
    "execution_mode": {
      "type": "string",
      "enum": ["v1", "v2"],
      "description": "Execution mode for the sprint. v1 = legacy sequential; v2 = worktree-parallel."
    },
    "sprint_status": {
      "type": "string",
      "description": "Overall sprint status",
      "examples": ["Active", "Closed"]
    },
    "stories": {
      "type": "object",
      "description": "Map of story ID to story state entry",
      "additionalProperties": {
        "$ref": "#/definitions/StoryEntry"
      }
    },
    "last_action": {
      "type": "string",
      "description": "Human-readable description of the last operation performed"
    },
    "updated_at": {
      "type": "string",
      "format": "date-time",
      "description": "ISO-8601 timestamp of last top-level update"
    }
  },
  "definitions": {
    "StoryEntry": {
      "type": "object",
      "required": [
        "state",
        "qa_bounces",
        "arch_bounces",
        "worktree",
        "updated_at",
        "notes",
        "lane",
        "lane_assigned_by",
        "lane_demoted_at",
        "lane_demotion_reason"
      ],
      "additionalProperties": true,
      "properties": {
        "state": {
          "type": "string",
          "enum": [
            "Ready to Bounce",
            "Bouncing",
            "QA Passed",
            "Architect Passed",
            "Sprint Review",
            "Done",
            "Escalated",
            "Parking Lot"
          ],
          "description": "Current lifecycle state of the story"
        },
        "qa_bounces": {
          "type": "integer",
          "minimum": 0,
          "maximum": 3,
          "description": "Number of QA bounce cycles. Reaching 3 triggers auto-escalation."
        },
        "arch_bounces": {
          "type": "integer",
          "minimum": 0,
          "maximum": 3,
          "description": "Number of Architect bounce cycles. Reaching 3 triggers auto-escalation."
        },
        "worktree": {
          "type": ["string", "null"],
          "description": "Path to the story's git worktree checkout, or null if not in a worktree"
        },
        "updated_at": {
          "type": "string",
          "format": "date-time",
          "description": "ISO-8601 timestamp of last update to this story entry"
        },
        "notes": {
          "type": "string",
          "description": "Free-form notes for this story (escalation reason, QA comments, etc.)"
        },
        "lane": {
          "type": "string",
          "enum": ["standard", "fast"],
          "description": "Execution lane for this story. Default 'standard'. Set by Architect at sprint design or via --lane flag."
        },
        "lane_assigned_by": {
          "type": "string",
          "enum": ["architect", "human-override", "migration-default"],
          "description": "Who assigned the lane value. 'migration-default' for stories migrated from v1."
        },
        "lane_demoted_at": {
          "type": ["string", "null"],
          "format": "date-time",
          "description": "ISO-8601 timestamp when the story was demoted from fast to standard, or null if never demoted."
        },
        "lane_demotion_reason": {
          "type": ["string", "null"],
          "description": "Human-readable reason for lane demotion, or null if never demoted."
        }
      }
    }
  }
}
