{
  "schema_version": 2,
  "sprint_id": "SPRINT-001",
  "execution_mode": "v1",
  "sprint_status": "Closed",
  "stories": {
    "STORY-001-01-Bootstrap-Astro-App": {
      "state": "Done",
      "qa_bounces": 0,
      "arch_bounces": 0,
      "worktree": null,
      "updated_at": "2026-04-27T09:45:02.844Z",
      "notes": "QA approved at f19f39c. Tailwind v4 :root workaround accepted.",
      "lane": "standard",
      "lane_assigned_by": "migration-default",
      "lane_demoted_at": null,
      "lane_demotion_reason": null
    },
    "STORY-001-02-Typed-Content-Layer": {
      "state": "Done",
      "qa_bounces": 0,
      "arch_bounces": 0,
      "worktree": null,
      "updated_at": "2026-04-27T09:50:20.277Z",
      "notes": "QA approved at f0d6856. 4/4 scenarios; 63-word collab paragraph.",
      "lane": "standard",
      "lane_assigned_by": "migration-default",
      "lane_demoted_at": null,
      "lane_demotion_reason": null
    },
    "STORY-001-03-Asset-Extraction": {
      "state": "Done",
      "qa_bounces": 0,
      "arch_bounces": 0,
      "worktree": null,
      "updated_at": "2026-04-27T10:01:18.486Z",
      "notes": "QA approved at 969f09e. 6/6 scenarios. 6.7MB total assets. Dev hit token limit; orchestrator finalized commit.",
      "lane": "standard",
      "lane_assigned_by": "migration-default",
      "lane_demoted_at": null,
      "lane_demotion_reason": null
    },
    "STORY-001-04-Hero-Team-Collaboration": {
      "state": "Done",
      "qa_bounces": 1,
      "arch_bounces": 0,
      "worktree": null,
      "updated_at": "2026-04-27T10:15:29.279Z",
      "notes": "QA approved at 13ba084 after 1 bounce. Defect: reveal observer ran during HTML parse before all .reveal-init nodes existed. Fix: deferred init to DOMContentLoaded. 6/6 scenarios. JS=4890 bytes.",
      "lane": "standard",
      "lane_assigned_by": "migration-default",
      "lane_demoted_at": null,
      "lane_demotion_reason": null
    },
    "STORY-001-05-Solution-Sections": {
      "state": "Done",
      "qa_bounces": 0,
      "arch_bounces": 0,
      "worktree": null,
      "updated_at": "2026-04-27T11:21:27.510Z",
      "notes": "QA approved at 56d47ce after pre-QA hoist (eb4e038 -> 56d47ce). Inline JS 12225 -> 927 bytes by hoisting Reveal script to Base.astro. 6/6 scenarios; 15 reveal-init nodes; 26 imgs all lazy/async/dims/alt.",
      "lane": "standard",
      "lane_assigned_by": "migration-default",
      "lane_demoted_at": null,
      "lane_demotion_reason": null
    },
    "STORY-001-06-Common-Thread-Footer-Polish": {
      "state": "Done",
      "qa_bounces": 0,
      "arch_bounces": 0,
      "worktree": null,
      "updated_at": "2026-04-27T11:29:46.871Z",
      "notes": "QA approved at abdbdc8. 6/6 scenarios. PDFs reach dist/. 5 prefers-reduced-motion blocks. h1=1 h2=6 h3=17 outline valid.",
      "lane": "standard",
      "lane_assigned_by": "migration-default",
      "lane_demoted_at": null,
      "lane_demotion_reason": null
    },
    "STORY-001-07-Dockerfile-and-Coolify": {
      "state": "Done",
      "qa_bounces": 0,
      "arch_bounces": 0,
      "worktree": null,
      "updated_at": "2026-04-27T11:45:00.000Z",
      "notes": "QA approved at 1299f07. 8/8 scenarios. nginx:alpine 127.0.0.1 healthcheck deviation accepted (no localhost DNS in alpine). Image 87.3 MiB > 80 MB cap accepted as structurally unavoidable (nginx:alpine 53 MB + 22 MB PDFs).",
      "lane": "standard",
      "lane_assigned_by": "migration-default",
      "lane_demoted_at": null,
      "lane_demotion_reason": null
    }
  },
  "last_action": "Sprint closed. REPORT.md generated. All 7 stories shipped; 1 QA bounce; 0 arch bounces.",
  "updated_at": "2026-04-27T16:00:00.000Z"
}
